[
  { "exp_id": "exp-101", "title": "Drift vs load cycles, bench", "hypothesis": "IMU drift grows with cumulative vibration energy, not elapsed time", "outcome": "supported: r = 0.91 against energy, 0.34 against time", "metric": "r", "value": 0.91, "confidence": 7, "dataset_id": "ds-bench-sweep", "paper_ids": ["paper-imu-drift"], "tags": ["vibration", "sensor"], "run_on": "2026-06-12", "logged_on": "2026-06-12" },
  { "exp_id": "exp-102", "title": "Cohort re-analysis, traffic load", "hypothesis": "fatigue indicators in the bridge cohort track traffic load better than age", "outcome": "supported on 31 of 40 bridges", "metric": "bridges", "value": 31, "confidence": 8, "dataset_id": "ds-bridge-cohort", "paper_ids": ["paper-cohort", "paper-miner"], "tags": ["fatigue", "longitudinal-study"], "run_on": "2026-07-03", "logged_on": "2026-07-04" },
  { "exp_id": "exp-103", "title": "Modal shift under temperature", "hypothesis": "temperature explains most of the modal variability the review warns about", "outcome": "partly: 62 percent of variance", "metric": "variance", "value": 0.62, "confidence": 6, "dataset_id": "ds-bridge-cohort", "paper_ids": ["paper-shm-review"], "tags": ["vibration", "statistics"], "run_on": "2026-08-14", "logged_on": "2026-08-14" },
  { "exp_id": "exp-104", "title": "Joint model, drift and fatigue", "hypothesis": "one cumulative-energy model fits both sensor drift and structural fatigue", "outcome": "pending: fit converges, hold-out not yet run", "metric": "rmse", "value": 0.08, "confidence": 4, "dataset_id": "ds-bench-sweep", "paper_ids": ["paper-imu-drift", "paper-cohort"], "tags": ["fatigue", "sensor", "vibration"], "run_on": "2026-09-20", "logged_on": "2026-09-21" }
]
